id,title,journal,pub_year,country,abstract_en,body_en,abstract_es,body_es
dialnet-2525360,"OCUPACIÓN Y REPRODUCCIÓN DEL LIRÓN GRIS (Glis glis LINNAEUS, 1766) EN NIDALES ARTIFICIALESEN BOSQUES CADUCIFOLIOS CATALANES",Galemys,2007,esp,"The rate of occupation of nest-boxes by the fat dormouse in Catalan deciduous forests was studied. During 2004-2005, we systematically reviewed more than 400 nest-boxes of four different types (three models for insectivorous birds, and one especially designed for dormice) located in six different localities. The rate of occupation was very heterogenous, depending as much on the locality as on the type of box. Therefore, the maximum frequency of occupation of boxes by adult individuals was 25% in Montnegre-Corredor (oakwood and chestnut grove), and 42% in the Grevolosa beech forest, whereas in other localities the occupation rate was very low or nonexistent. Nest-boxes of the models “Sitta” and “Parus” yielded similar results in the localities where they were set together. Nest-boxes began to be occupied in July, with increased occupation in August, the time at which females look for appropriate nests to give birth. In September, we found females with small young in Montnegre-Corredor, the only locality in which it was possible to verify breeding. The average number of young per litter was 4.75, ranging between 4 and 7 young per nest (n= 4). The date of birth was recorded in three nests on the 19th, 21st and 22nd of September 2005, showing high synchrony. In November, an increase in the presence of dormice was observed that may associated with dispersal of the young. Finally, no dormice were found in the boxes during the check made in winter. ",,"Se estudia la tasa de ocupación de nidales artificiales (cajas-nido) por el lirón gris en bosques caducifolios catalanes. Para ello, durante el período 2004-2005 se revisaron sistemáticamente más de 400 nidales de cuatro tipos distintos (3 modelos para aves insectívoras, y uno especial- mente diseñado para lirones) situados en 6 localidades diferentes. La tasa de ocupación fue muy heterogénea, dependiendo tanto de la localidad como del tipo de nidal. Así pues, la frecuencia máxima de ocupación de cajas por individuos adultos se situó en el 25% en el Montnegre-Co- rredor (robledal-castañar), y en el 42% en el hayedo de la Grevolosa, mientras que en otras loca- lidades fue muy baja o inexistente. Los nidales de los modelos “Sitta” y “Parus” rindieron resul- tados parecidos en las localidades en que se dispusieron conjuntamente. Los nidales empezaron a ocuparse en julio, incrementándose su ocupación en agosto, época en que las hembras buscan nidos apropiados para alumbrar. En septiembre se encontraron hembras con crías pequeñas en el Montnegre-Corredor, la única localidad en que se ha podido comprobar la reproducción. El número medio de crías por camada fue de 4,75, con una variación entre 4 y 7 crías por nido (n= 4). La fecha de nacimiento de las crías fue estimada en tres nidos el 19, 21 y 22 de septiembre del 2005, hecho que demuestra una elevada sincronía. En noviembre se observó un incremento de la presencia de lirones que se puede asociar a la dispersión juvenil. Finalmente, en la revisión realizada en pleno invierno no se encontró ningún individuo de lirón gris en las cajas. ",
dialnet-3033808,"SUPERVIVENCIA, DISPERSIÓN Y SELECCIÓNDE RECURSOS DE CORZOS Capreolus capreolus (LINNAEUS, 1758) REINTRODUCIDOS EN UN HÁBITATMEDITERRÁNEO",Galemys,2009,esp,"During the years 2002-2004, 38 roe deer (23 females and 15 males) were released in the National Hunting Reserve of Ports (southern Catalonia, Spain) with the aim to analyze their via- bility as a first step before starting a reintroduction project in this area. A total of 39 individuals were captured in France (Chizé State Forest) and 9 ones in Alt Pallars NHR (Lleida, Pyrenees). Thirty individuals were released with a radio transmitter so that their movements could be mo- nitored. Roe deer disappeared in these mountains at the end of 19th century, as it happened in other areas in the Mediterranean coast, and as a consequence of the decrease of forest surface and the absence of hunting management. In Catalonia, from the beginning of 1990s, several projects on roe deer reintroduction in the coastal mountains have been going on. In the present study, dispersal patterns, survival probability, and mortality rate were estimated from 589 radioloca- tions, and the viability of the reintroduction evaluated. Resource selection estimated by logistic regression was calculated, our results predicting roe deer successful occurrence in Ports. ",,"Durante los años 2002, 2003 y 2004 se liberaron un total de 38 ejemplares de corzo (23 hembras y 15 machos) en la Reserva Nacional de Caza de Ports (sur de Cataluña) con el objetivo de analizar su viabilidad como paso previo a un programa de reintroducción en esta zona. En total 29 corzos fueron capturados en la reserva de Chizé (Landas, Francia) y 9 más en la RNC de Alt-Pallars (Lleida, Cataluña). El corzo desapareció de este macizo a finales del siglo XIX, de forma similar a otras zonas del litoral mediterráneo, como consecuencia de la reducción de la superficie forestal y la falta de gestión y conservación de sus poblaciones. En Cataluña, desde principios de la década de 1990, se han iniciado diferentes proyectos de reintroducción de esta es- pecie en las cordilleras litorales con vistas a la restauración de la comunidad de ungulados salvajes. A partir de 589 localizaciones de 30 de estos ejemplares se estimaron los patrones de dispersión, la probabilidad de supervivencia y la tasa de mortalidad, y de esta forma se evaluó la viabilidad de la reintroducción. La selección de recursos se calculó mediante regresión logística y el resultado predice la presencia de los corzos reintroducidos en el área elegida. ",
dialnet-5107885,Rescate y retorno a estado salvaje de un oso pardo es Asturias (España),Galemys,2001,esp,"A female brown bear (Ursus arctos, L.), two years old, located near a road in march 28, 1999, with locomotion difficulties and no fleeing behavior from humans, was inmobilized with a blowgun and tagged with a hair transmitter. After a first inspection on the ground (breath and heart rates and body temperature) only some wounds on mouth and muzzle were apparent. Translocated in a Culvert trap to a Veterinary Faculty (León) 130 km away, was anaesthesized for body radiography and ventral ecographies, and blood and body samples were taken for haemathology, toxicology and parasites analysis, all of them drawn normal or negative results, so no accurate diagnosis was possible. The bear was in a box trap without human contact for inespecific treatment (feeding, qiuetness, antibiotic administration) for some days. Because of apparent fairly good locomotion and recovery, was released 10 days later, some 2,5 km apart from the capture site, and was radiolocated until failure of transmitter four days later. Nevertheless, it was observed one and a half months later, feeding on a slope two km apart from release site. Results from more complex toxicological analysis of blood samples, available some months later, revealed presence of carbofurano and metomilo, poisoning probably ingested as bait. ",,"Una hembra de oso pardo (Ursus arctos, L.), localizada junto a una carretera el 28 de marzo de 1999 con dificultades motrices y que no mostraba el comportamiento habitual de huida, fue capturada y dotada de un transmisor. Tras una inspección sobre el terreno, en la que sus ritmos respiratorios y cardiacos y su temperatura corporal resultaron normales, se le detectaron algunas heridas en boca y hocico. Trasladada a la Facultad de Veterinaria de León en una caja Culvert, fue anestesiada para la rea- lización de radiografías, de ecografía abdominal, y toma de muestras para diversos análisis (hematológicos, parasitológicos, toxicológicos e infecciosos), todos con resultados normales o negati- vos, sin que pudiera realizarse un diagnóstico preciso. Se le mantuvo en un recinto aislado, evitando el contacto humano, aplicándole un tratamiento inespecífico (descanso, abundante alimentación y sumi- nistro de un antibiótico de amplio espectro). Tras la positiva recuperación y con una aparente buena motricidad se le liberó el 7 de abril de 1999 a 2,5 Km del sitio de captura. Desde entonces se le radiolocalizó continuamente pero el transmisor empezó a fallar y se perdió la señal el 11 de abril. Se identificó visualmente el ejemplar el 25 de mayo, por portar aún el transmisor, alimentándose en una ladera sola- na a 2 Km del punto de suelta, aparentemente en buenas condiciones. Los resultados de los análisis toxicológicos sobre muestra de sangre, disponibles algunos meses más tarde, detectaron la presencia de carbofurano y metomilo en dosis que indicaban su posible ingesta como cebo. ",
dialnet-3684339,"Programa de conservación del borrego cimarrón (avis canadensis weemsi) en Baja California Sur, México",Galemys,2010,esp,"Given the ecological, cultural and economic importance that represents the desert bighorn sheep and considering its population situation in Mexico, OVIS in 1995 presents to the Federal Government the “Conservation Program of the desert bighorn sheep (Ovis canadensis weemsi) in South Baja California (SBC), Mexico”, which is guaranteed, authorized and supported by the Government of Baja California and the Municipality of Loreto, SBC. The program is developed in 2 stages: 1) Introduction and reproduction of desert bighorn sheep (O. c. weemsi) in Carmen Island, SBC and 2) Repopulation of continental lands with desert bighorn sheep coming from Carmen Island and then obtain sustainable advantage. At the moment a population of 450 bighorn sheep are estimated in Carmen Island, reason why OVIS continues with the long term repopulation activities that contributes to reach the historical population levels. The greater success of the program will be reached when the populations of desert bighorn sheep returns to cover South Baja California in its original distribution area, as well as other areas of historical distribution of the specie. ",,"Dada la importancia ecológica, cultural y económica que representa el borrego cimarrón y considerando su situación poblacional en México, OVIS en 1995 presenta al Gobierno Federal el “Programa de conservación del borrego cimarrón (Ovis canadensis weemsi) en Baja California Sur (BCS), México”, el cual es avalado y autorizado, contando con el apoyo de los gobiernos tanto estatal como municipales en cuestión. El programa se desarrolla en 2 etapas: 1) Introducción y reproducción del borrego cimarrón (O. c. weemsi) en isla El Carmen, BCS y 2) Repoblación de tierras continentales con borregos procedentes de dicha isla y posterior aprovechamiento sustentable. Actualmente se estima una población de 450 borregos en isla El Carmen, por lo que OVIS tiene como objetivo continuar con las actividades de repoblación a largo plazo para contribuir a la recuperación de los niveles poblacionales alcanzados históricamente. El mayor éxito del programa se alcanzará cuando las poblaciones de borrego cimarrón vuelvan a cubrir las tierras de Baja California Sur en toda su área de distribución original, así como otras áreas de distribución histórica de la especie. ",
dialnet-7144275,La importancia del agrosistema tradicional faxinal para la conservación de los bosques del sur de Brasil,Revista Ecosistemas,2017,esp,"The Importance of the Traditional Agrosystem Faxinal to the Southbrazilian Forests Conservation. Faxinal is a traditional land organization form of production that withstand to agribusiness. It consists on the collective animal pasture within the Araucaria forest understory and the low impact forestry management. These community forests compound some of the last preserved areas of the Atlantic Forest in the South Brazil Highlands, deserving the status of ARESUR - a controversial conservation unit not yet completely recognized that rewards the landowners for their commitment in forest preservation. Nevertheless, some authors argue that these efforts are useless once this management would not protect the forest integrity. Therefore, in order to comprove the importance of this agrosystem we have performed a phytosociological survey at six Faxinals and compared to a regional preserved mid understory at Açungui National Forest. It were identified 172 species (42 families). The major IVI were performed by Casearia species (decandra, obliqua, and sylvestris), Cinnamodendron dinisii, Podocarpus lambertii, Ilex paraguariensis, Matayba elaeagnoides, Ocotea odorifera, Eugenia pluriflora, Campomanesia xanthocarpa, Myrceugenia myrcioides, and Myrcia hatschbachii had the higher IVI. The comparative analysis has pointed that the vegetation at Faxinais are not different from the National Reserve one, in spite of some floristic divergences. We could conclude that the efforts to preserve the Faxinal community forests are consistent to the conservation strategies for the Atlantic Forest resilience. ",,"La importancia del agrosistema tradicional Faxinal para la conservación de los bosques en el sur de Brasil. Faxinal constituye una forma de organización y producción tradicional campesina caracterizada por la producción colectiva de animales en los sub-bosques de Araucarias. Esos creadores comunitarios componen algunos de los últimos remanentes conservados de la Mata Atlántica en los altiplanos sur-brasileños, mereciendo así el status de ARESUR – una unidad de conservación polémica, no totalmente reconocida, que recompensa a propietarios por su compromiso con la conservación de los bosques. Algunos autores argumentan que estos esfuerzos son inútiles ya que esto no protege la integridad de los bosques. Así, para comprobar la importancia de ese agrosistema analizamos la estructura fitosociológica de seis faxinales, comparando con un bosque también secundario preservado en Bosque Nacional Açungui. Se identificaron entre los faxinales y el área de conservación un total de 172 especies (42 familias) y el mayor Índice de Valor de Importancia correspondió a las especies de Casearia (decandra, obliqua y sylvestris), Cinnamodendron dinisii, Podocarpus lambertii, Ilex paraguariensis, Matayba elaeagnoides, Ocotea odorifera, Eugenia pluriflora, Campomanesia xanthocarpa, Myrceugenia myrcioides y Myrcia hatschbachii. El análisis comparativo apunta que los bosques en los faxinales no san estructuralmente diferentes del área conservada en Açungui, a pesar de que hayan algunas diferencias florísticas. Se puede concluir que los esfuerzos por preservar a criadores comunitarios de faxinales son consistentes con las estrategias de conservación para la permanecía de la Mata Atlántica. ",
dialnet-4775431,"Restauración de bosque nativo en un área invadida por tamariscos Tamarix ramossisima en el sur de la provincia de Córdoba, Argentina",Revista Ecosistemas,2013,esp,"Humans produce impacts on ecosystems, where invasive alien species are considered one of the most relevant. In this sense, the restoration ecology, allows repairing ecosystems to be able to persist in future environments. The objective of this work was to design and implement management tech- niques for recovery environments invaded by saltcedar in the southern of Córdoba. We conducted an experimental restoration trial through saltcedar control (cut-stump method), selection of native species for reforestation and analyze the seed bank of saltcedar and native forest patches. Twelve plots were delimited in a saltcedar´s forest, where four treatments were applied: 1) control, 2) cut down of saltcedar, 3) cut down and native species introduction and 4) cut down, native species introduction and transplantation of the seed bank. The variables saltcedar´s resprout, species richness, species coverage, plant survival and seedlings emergence from the seed bank were monitored during 20 months. The saltcedar control method was 89 % effective. We selected the following species to be used in the restoration trials: Lycium boerhaviifolium, Vachellia caven, Schinus. fasciculatus, Celtis ehrembergiana y Atriplex undulata. The implanted seed bank didn´t provide new individuals to the system. We highlight the importance of re- planting the areas with patches of native woody species after saltcedar control in order to increase the biodiversity and resilience of the system. ",,"El hombre produce impactos acumulativos sobre los ecosistemas, siendo las especies exóticas invasoras uno de los más relevantes. Uno de los fines de la restauración ecológica es reparar los ecosistemas para que sean capaces de persistir en ambientes futuros. Este trabajo tiene como ob- jetivo diseñar e implementar técnicas de manejo para la recuperación de ambientes invadidos por tamariscos Tamarix ramossisima en el sur de Córdoba (Argentina). Se realizó un ensayo de restauración consistente en el control de tamariscos (tala y aplicación de herbicida), selección y plan- tación de especies nativas y evaluación del banco de semillas germinable del bosque de tamarisco y del bosque nativo de referencia. Se delimitaron doce parcelas donde se aplicaron cuatro tratamientos: 1) testigo; 2) control de tamariscos; 3) control y plantación de especies nativas; y 4) control, plantación de especies nativas y trasplante de banco de semillas. Se monitoreó durante 20 meses las variables rebrote de tamarisco, riqueza de la comunidad, cobertura de las especies nativas, emergencia y supervivencia de las plántulas del banco de semillas. El 89 % de los individuos de ta- marisco no rebrotaron. Las especies seleccionadas y plantadas fueron Lycium boerhaviifolium, Vachellia caven, Schinus fasciculatus, Celtis ehrem- bergiana y Atriplex undulata. El banco de semillas no aportó nuevos individuos de especies nativas. Se destaca la importancia de la revegetación con especies leñosas nativas luego del control de tamariscos como estrategia para incrementar la biodiversidad. ",
arxius-1,Estima de la abundancia de palomas (Columba livia var.) de la ciudad de Barcelona y valoración de la efectividad del control por eliminación de individuos,Arxius de miscel·lània zoològica,2009,esp,"Culling is one of the most commonly used methods to control urban pigeon populations. The Barcelona Public Health Agency (ASPB) eliminated a total of 227,479 pigeons using this technique between 1991 and 2006. We compared the estimate of abundance of pigeons in Barcelona city in 1991 (183.667±14.914) with that in 2006 (256.663±26.210) (CI 95%). While pigeon density did not increase in the city centre during this period, density in a ring around the city increa- sed significantly, leading to a general increase in the urban population of these birds. The number of complaints regarding pigeons received per district did not correlate with abundance. ASPB culling per district correlated with abundance and not with numbers of complaints received, indicating interventions generally followed a technical protocol. Pigeon density per district correlated significantly with the human population density but not with the total number of inhabitants. Findings indicate the effectiveness of culling is low in this setting and suggest greater emphasis should be placed on control measures centered on limiting factors, particularly reduction of food availability and nest removal.",,"Uno de los métodos más comúnmente utilizados para el control de las poblaciones de palomas urbanas es la captura y eliminación selectiva de individuos. Con este método, la Agencia de Salud Pública de Barcelona (ASPB) eliminó entre 1991 y 2006, un total de 227.479 palomas. En el pre- sente trabajo se compara la abundancia de palomas de la ciudad de Barcelona estimada en 1991 (183.887±14.914), con los valores obtenidos en una nueva estima realizada en 2006, con un total de 256.663±26.210 (IC 95%) palomas. Mientras que en el centro de la ciudad la densidad de palomas no aumentó entre esos años, la densidad en todo el anillo que rodea el centro aumentó de forma significativa, conduciendo a un aumento global de toda la población urbana. El número de denuncias recibidas por distrito por molestias oca- sionadas por las palomas no se correlacionó con su abundancia. El esfuerzo de capturas por distrito realizado por la ASPB se correlacionó con la abundancia de palomas y no con el número de denuncias recibidas, lo que indica que las actuaciones realizadas siguen en general un protocolo técnico. La densidad de palomas por distrito se correlacionó signifi- cativamente con la densidad de habitantes de cada distrito, pero no con el número total de habitantes. Los datos presentados demuestran la baja efectividad de las medidas de control de palomas por eliminación de individuos, y abogan por un mayor énfasis en los métodos de control centrados en los factores limitantes de la especie, en concreto la oferta alimentaria y los lugares de nidificación. ",
dialnet-6524365,"Metodo simple y economico para minimizar la mortalidad de aves acuaticas en piscinas de lixiviacion de cobre, en el norte de Chile",Biodiversity and Natural History,2018,chl,"Extractive mining is vital for technological development in the world where Chile ranks first as a world copper exporter. How ever, this  activity generates tailings deposits and emergency pools with extremely toxic and acid waters, which are used by many sp ecies of birds,  generally causing the death of numerous individuals.  Teck CDA designed a system of suspended colored plastic flag lines located over the  emergency pools  and its effectiveness was evaluated as a strategy to avoid the use of pools by  waterfowl and reduce mortality. Between  2011 and 2017 a monitoring program was implemented for the birds that use the emergency pools, clear pools and the adjacent t ailing  dam. Our results indicated that during the period using colored flag lines, the deat h of any individual of some species of bird that could  potentially interact with the pools was not observed. It is concluded that the system of colored plastic flags lines over the  copper leaching  emergency pools, were effective in avoiding the use of toxi c pools and minimizing the deaths of waterfowl .   ",,"La minería extractiva es vital para el desarrollo tecnológico en el mundo donde Chile ocupa el primer lugar como exportador m undial de  cobre. Sin embargo,  Esta actividad genera depósitos de relave y piscinas de emergencia con aguas extremadamente tóxicas y  ácidas, que  son utilizadas por numerosas especies de aves, provocando generalmente la muerte de numerosos individuos.  Teck CDA diseñó e instaló  sobre las piscinas de emergencia un sistema de líneas con banderines de colores suspendidos y se evaluó su efec tividad como estrategia  para evitar el uso de las piscinas por aves acuáticas y reducir la mortalidad.  Entre los años 2011 y 2017 se ejecutó un programa de monitoreo  de las aves que usan las piscinas de emergencia, piscinas claras y el embalse contiguo. Nu estros resultados indicaron que durante el período  de uso de los banderines no se observó la muerte de ningún individuo de alguna especie de ave que potencialmente podría inter actuar con  las piscinas. Se concluye que el sistema de líneas de banderines plás ticos de colores sobre las piscinas de emergencia de lixiviación de cobre,  fueron efectivos evitando el uso de las piscinas tóxicas y minimizando las muertes de las aves acuáticas .  ",
